and a happy sydney gay and lesbian mardi gras this month even the a nz bank is celebrating in,9
hey kindly help me spread my new single to your amazing fans i believe they will love it happy thankyou ht,9
adopt dont shop happy update from pablo ex bonus and lilly ex kim how heartwarming to see our boy who was so sad and,9
friday work and play producer life friday vibes magic swag live like you are on vacation happy,9
adopt dont shop happy update from pablo ex bonus and lilly ex kim how heartwarming to see our boy who was so sad and,9
what a week alll the learning 3 days in an loving it made the right choice happy,9
learn how to be happy with what you have while you pursue all that you want jim rohn inspiration quotes,9
nothing changes if nothing changes paz gratitude blessings happy moving forward awakening changes soul conscious,9
we love reading reviews from our happy customers,9
we sure love fridays enjoy your weekend happy friday friday feeling friday orca displays happy weekend vibes https,9
happy with your government corporate bond returns,9
if you want to be happy set a goal that commands your thoughts liberates your energy inspires your hopes a carnegie quote,9
hey kindly help me spread my new single to your amazing fans i believe they will love it happy thankyou ht,9
nothing changes if nothing changes paz gratitude blessings happy moving forward awakening changes soul conscious,9
learn how to be happy with what you have while you pursue all that you want jim rohn inspiration quotes,9
i m following back everyone who s listening to my new song happy and you have to post me a screenshot of it happy by moe logo,9
adopt dont shop happy update from pablo ex bonus and lilly ex kim how heartwarming to see our boy who was so sad and,9
beardlicious is finally getting home tonight happy,9
adopt dont shop happy update from pablo ex bonus and lilly ex kim how heartwarming to see our boy who was so sad and,9
nothing changes if nothing changes paz gratitude blessings happy moving forward awakening changes soul conscious,9
naver happy moment,9
learn how to be happy with what you have while you pursue all that you want jim rohn inspiration quotes,9
2 happy heifer calves enjoying another feb ru dairy morning love cows team dairy,9
date night love happiness friday night him so happy glasgow laughs chat the,9
learn how to be happy with what you have while you pursue all that you want jim rohn inspiration quotes,9
nothing changes if nothing changes paz gratitude blessings happy moving forward awakening changes soul conscious,9
learn how to be happy with what you have while you pursue all that you want jim rohn inspiration quotes,9
a fabulous time celebrating 2017 releases by new school writing program alumni faculty thanks,9
hey kindly help me spread my new single to your amazing fans i believe they will love it happy thankyou ht,9
adopt dont shop happy update our sunni saved by our roger b who diagnosed her in september grown a bit and sti,9
be the love you never received paz gratitude blessings happy moving forward awakening changes soul consciousness,9
enjoy the beauty of the summer happy wednesday enjoy these amazing flower vine by,9
happy friday rt xxxxx,9
adele tells us how it really is quote positive happy,9
love makes the world go round happy and horny have a great weekend lovers and friends,9
there is a difference between knowing the path and walking the path a happy weekend everyone quote,9
nothing changes if nothing changes paz gratitude blessings happy moving forward awakening changes soul conscious,9
shaund,9
5 tips to wiping negativity out of your life happy success flourish,9
there is a difference between knowing the path and walking the path a happy weekend everyone,9
hey abaga please help me spread this to your amazing fans i believe they will love it happy thankyou,9
enjoy the beauty of the summer happy wednesday enjoy these amazing flower vine by,9
afternoon grab the happy briefs at,9
today is the day actress actor good pretty young actor child actor young hollywood blueeye s blonde,9
adopt dont shop happy update two of our golden sisters adopted incredibly fast after arriving at say we lo,9
working on a few new things rabbit easter bunny art happy,9
happy friday our appycart is brightening up this dreary february day friday fri yay celebration,9
happy friday our appycart is brightening up this dreary february day friday fri yay celebration,9
brothers brothers fun siblings family love happy,9
have a good weekend pet dog lover adorable pets love animal puppy dogs animals puppies doggy,9
finally friday knickknack dog treats happy friday weekend,9
reposting via i wonder what adam and eve will be soon in the technology world li,9
perry kitchen happy with huge privilege to play for la galaxy this year,9
happy birthday theophilus london via happy,9
happy birthday ab soul via happy,9
enjoy the beauty of the summer happy wednesday enjoy these amazing flower vine by,9
exploring the link between mood and wellness is there really a link between mood and,9
do the things that make you happy in life,9
hey kindly help me spread my new single to your amazing fans i believe they will love it happy thankyou ht,9
design ideas no 342 you have the look we have the mattress bedroom furniture 714 288 2070 lowest prices,9
nothing changes if nothing changes paz gratitude blessings happy moving forward awakening changes soul conscious,9
adopt dont shop happy update from pablo ex bonus and lilly ex kim how heartwarming to see our boy who was so sad and,9
hey kindly help me spread my new single to your amazing fans i believe they will love it happy thankyou ht,9
hello friday you re looking well friday feeling happy at austria zill er vine by,9
here too for the past 3 days but it there s less snow than i thought there would be happy,9
vermentino with a thai green curry tough paring but it gone down well vino wine vin ho wine jam,9
women s sleepyz slippers with poms style women me cute vs co cam f 4 f flowers family follow happy 20 00,9
be the love you never received paz gratitude blessings happy moving forward awakening changes soul consciousness,9
you know that happy feeling you get when you get the perfectly poured and it s friday after work th,9
and i m reading autobiography of a yogi learning happy,9
own vlad happy dracula untold luke evans let me introduce you to my own vlad i hope you like it and t,9
counting down day almost over friday ready for the weekend happy ricoh usa,9
adopt dont shop happy update our sunni saved by our roger b who diagnosed her in september grown a bit and sti,9
adele tells us how it really is quote positive happy,9
2016 vs 2018 princess 5 k set goals dream large and just keep chasing them never give up fitness,9
adopt dont shop happy update from pablo ex bonus and lilly ex kim how heartwarming to see our boy who was so sad and,9
happy mama visiting my kids santa monica california,9
tks god for more one week gratitude bearded happy best job in love,9
give your love flowers that last a lifetime beautiful handmade quilts m inky blanket wedding anniversary happy eas,9
enjoy the beauty of the summer happy wednesday enjoy these amazing flower vine by,9
pho only gives pho gives pleasure pho gives fulfillment pho gives happyness get some pho in your life,9
birthday girl hd baby kesar ia happy hb d daughters fatherhood tbilisi georgia,9
all welcome open house on saturday 2 24 and sunday 2 25 2 4pm open house new hyde park house realestate happy relax,9
all welcome open house on saturday 2 24 and sunday 2 25 2 4 pm open house flushing house realestate happy rel,9
all welcome open house on sunday 2 25 2 4 pm open house flushing house realestate happy relax realtor sunda,9
adele tells us how it really is quote positive happy,9
tks god for more one week gratitude bearded happy best job in love,9
nothing changes if nothing changes paz gratitude blessings happy moving forward awakening changes soul conscious,9
tks god for more one week gratitude bearded happy best job in love,9
be the love you never received paz gratitude blessings happy moving forward awakening changes soul consciousness,9
adele tells us how it really is quote positive happy,9
one of my birthday gifts came early today my mom went to pick her up today to surprise me for my party tomorrow,9
adopt dont shop happy update from pablo ex bonus and lilly ex kim how heartwarming to see our boy who was so sad and,9
leave footprints of kindness wherever you go paz gratitude blessings happy moving forward awakening changes soul,9
enjoy the beauty of the summer happy wednesday enjoy these amazing flower vine by,9
nothing changes if nothing changes paz gratitude blessings happy moving forward awakening changes soul conscious,9
all welcome open house on sunday 2 25 2 4 pm open house flushing house realestate happy relax realtor,9
peace love bobby sherman happy olympics 2 0 1 8 ribbit,9
all welcome open house on saturday 2 24 and sunday 2 25 2 4 pm open house flushing house realestate happy,9
all welcome open house on saturday 2 24 and sunday 2 25 2 4pm open house new hyde park house realestate happy,9
compass happy fir day from gn compass good day fir day happy gn compass gn ct,9
make each day your masterpiece paz gratitude blessings happy moving forward awakening changes soul consciousness,9
aww yeah it s all good bing bong bing bong happy,9
enjoy the beauty of the summer happy wednesday enjoy these amazing flower vine by,9
happy friday from this devil aloha friday happy weekend,9
hello friday you re looking well friday feeling happy at austria zill er vine by,9
hey abaga please help me spread this to your amazing fans i believe they will love it happy thankyou,9
booked my next trip 10 days to portugal yay solo travel happy,9
life only comes around once so do whatever makes you happy,9
god bless this friday happy,9
i need my nude time nude nudist nudism naked nudity naturism naturist bare nude beach f kk freedom happy top l,9
hey kindly help me spread my new single to your amazing fans i believe they will love it happy thankyou ht,9
,9
they need to stop with this bullshit stress l 4 l me me m emes thou holy m emes lol comedy f 4 f,9
life only comes around once so do whatever makes you happy,9
distance like pic of the day likes for likes comment shout out,9
i need my nude time nude nudist nudism naked nudity naturism naturist bare nude beach f kk freedom happy top l,9
,9
zen living an awesome life being good learning everything i can doing good and helping others,9
pickup happy cafe music jazz bossa nova latin instrumental music for work study,9
rails thank you kindly,9
happy saturday my fabulous friends happy life amazing fun smile beauty girl summer,9
happy friday fri yay pilates with the magical julie peterson extension swan swimming,9
once there gone its a wrap happy content,9
thanks to all my 700 followers happy to share with you,9
friday friday kiss workflow friday morning weekend ginger coffee starbucks smile happy work boobs milf silly,9
hey abaga please help me spread this to your amazing fans i believe they will love it happy thankyou,9
good morning morning flowers feb month wow fresh day happy morning new daysaturday 24th feb new,9
being on diet 6 wks lost 1 stone happy,9
happy saturday miracle mile day has arrived may everyone and anyone lucky enough to have a starter,9
hey kindly help me spread my new single to your amazing fans i believe they will love it happy thankyou ht,9
is marriage an achievement anyway what s the point if you are not happy what s the point if you are in for s,9
nothing changes if nothing changes paz gratitude blessings happy moving forward awakening changes soul,9
getting friday going almost wine o clock grabbing it and gone happy friday,9
adopt dont shop happy update from pablo ex bonus and lilly ex kim how heartwarming to see our boy who was so sad and,9
if you are not happy in you money won t sort you out gratitude is the key stay grateful you find happiness even when penniless,9
cristian vlad happy thursday,9
new challenge explore space centre ho u dream big astronaut blessed determination motivation nasa happy,9
getting some zzzzz s before i go for a fab walk with my sis and dad in the morning worlds happiest dog,9
hey abaga please help me spread this to your amazing fans i believe they will love it happy thankyou,9
guess what we ve met the high standards of bbb accreditation tgim digtial publishing is now part of an elite,9
flashback friday somethings never change happy friday cheers,9
those lashes tho maybe she s born with it maybe it s mylo lashes happy friday fun pretty weekend,9
love makes the world go round happy and horny have a great weekend lovers and friends,9
new spot tv entrez dan slad anse happy family,9
cheers happy blessed thankful t gif,9
hey kindly help me spread my new single to your amazing fans i believe they will love it happy thankyou ht,9
happy friday last few hours to save 20 off don t miss out fun new designs and items available now icj uk,9
i m alive happy n healthy,9
happy friday everyone friday happy construction construction company build built builder building crew,9
love makes the world go round happy and horny have a great weekend lovers and friends,9
numeracy co ordinators are over the moon too happy numeracy made our weekend appreciate it,9
making money moves photo photo of the day photographer love pic of the day beautiful inst a good,9
if you want to be happy be wednesday wisdom happy day love flowers vi vine by,9
there are always alternativewaystoheal mind body and soul alternative healing,9
adopt dont shop happy update from pablo ex bonus and lilly ex kim how heartwarming to see our boy who was so sad and,9
15 simple rules to explain men to women valentines day love women men relationships,9
15 simple rules to explain men to women valentines day love women men relationships,9
15 simple rules to explain men to women valentines day love women men relationships,9
d let s do something fun tonight momma yup this happy friday cozy grateful stillness,9
fun happy night hot leather stripper black latex cat costume,9
i choose a community of trees over a community of buildings and i don t think i seek this alone 2 23 2018,9
hey abaga please help me spread this to your amazing fans i believe they will love it happy thankyou,9
ribbon in the sky v i e r n e s love pic of the day photo of the day sun happy friday sky,9
oh snap i m going to miss my interview learn how to cancel or reschedule a job interview if you can t make it,9
new music in less than a month if you re ready happy 0 1 2,9
review expo circles by magazine gente art artist blue illustration artwork happy sketch beaut,9
friday friday kiss workflow friday morning weekend ginger coffee starbucks smile happy work boobs milf silly,9
review expo circles by magazine gente art artist blue illustration artwork happy sketch,9
very happy with my cardiff under 9 s tonight vs newport great team performance and some very good football played,9
more and more parents are raising healthy happy children with essential oils,9
trader which brokers do you recommend afxsi i trade with many ecn brokers www dot afxsi dot com good grow fast happy invest japan,9
it s 5 00 somewhere have a great weekend happy friday feeling weekend via,9
karma is just wonderful just saying happy,9
icymi they told me i didn t understand the assignment and i told them they didn t understand life john lennon,9
all that we see or seem is but a dream within a dream a call to action for all those beautiful cool happy,9
icymi they told me i didn t understand the assignment and i told them they didn t understand life john lennon,9
new music in less than a month if you re ready happy 0 1 2,9
get the mother of all margaritas source akicel mexican restaurant gas town food dinner full enough too much,9
sunday picture bubbles fun happy happy days my sunday photo photo pumpkin ella baby silent sunday,9
h getting our happy on just dance 2 0 1 8 live now on,9
check out 3322 sw fairway point website just listed in oak harbor james philips en,9
hey kindly help me spread my new single to your amazing fans i believe they will love it happy thankyou ht,9
when life gets crazy how do you keep moving forward success entrepreneur girl boss happy lifestyle,9
living able breathing grateful t gif happy healthy wealthy focus tunnel vision prosperity bailar dance,9
remember to smile elegant era of excellence smile happy iringa,9
jackson jackson jackson guitars my eye sare burning fire in the hole hows you mamma anthem side effects happy,9
give your love flowers that last a lifetime beautiful handmade quilts m inky blanket wedding anniversary happy eas,9
i finally found a way how to delete old tweets you might find it useful as well happy delete tweets,9
and ernie exhausted but happy,9
happy feelings lt 3 happy feelings raffle lovely awesome rewards participate,9
let s be happy by missaracely happy choice article concentrate free soul excitement,9
hey abaga please help me spread this to your amazing fans i believe they will love it happy thankyou,9
hey kindly help me spread my new single to your amazing fans i believe they will love it happy thankyou ht,9
wishing everyone a very fun weekend get out explore what the world has to offer you happy fun weekend flirty italian girl,9
shopping for mommy playground for the little ones i sooo love mom life,9
had a wicked tv interview with the 1 only mr thank you giovanni sir for having me out yo,9
friday friday kiss workflow friday morning weekend ginger coffee starbucks smile happy work boobs milf silly,9
remember to smile elegant era of excellence smile happy,9
loved this the key to raising a happy child parenting parents moms 0 s e c o n d m o m,9
happy friday everyone,9
half off batch 500 ipa all weekend at terra firma growler fills too get your vitamin h ops superstar,9
fewer the necessities better your life will be dada bhagwan happy joy,9
ft happy produced by is a hit davido,9
the weekend is here t gif friday friday night weekend happy happy hides leopard geckos leopard gecko gecko geckos,9
do what makes you happy find love dating advice,9
lunch crepesywaffles crepes man cute summer blur sun happy fun dog hair beach,9
hey kindly help me spread my new single to your amazing fans i believe they will love it happy thankyou ht,9
give your love flowers that last a lifetime beautiful handmade quilts m inky blanket wedding anniversary happy eas,9
adopt dont shop happy update our sunni saved by our roger b who diagnosed her in september grown a bit and sti,9
learn colors with the magic train and steam locomotive mumbo s s parents child,9
adopt dont shop happy update two of our golden sisters adopted incredibly fast after arriving at say we lo,9
adopt dont shop happy update from pablo ex bonus and lilly ex kim how heartwarming to see our boy who was so sad and,9
hey kindly help me spread my new single to your amazing fans i believe they will love it happy thankyou ht,9
to all you pushing through the hard times keep going you can handle whatever life throws at you stay strong,9
adopt dont shop happy update from pablo ex bonus and lilly ex kim how heartwarming to see our boy who was so sad and,9
simply calphalon stainless steel 10 piece cookware set simply c alpha lon c alpha lon pots pans hanging new gift,9
hey kindly help me spread my new single to your amazing fans i believe they will love it happy thankyou ht,9
do what makes you happy find love dating advice,9
lunch crepesywaffles crepes man cute summer blur sun happy fun dog hair beach,9
the weekend is here t gif friday friday night weekend happy happy hides leopard geckos leopard gecko gecko,9
adopt dont shop happy update from pablo ex bonus and lilly ex kim how heartwarming to see our boy who was so sad and,9
i m the luckiest dream team happy love,9
want some vintage style in your life check out this gorgeous matched set for oroblu,9
t g i f thank god i m fabulous t gif feeling fabulous beautiful awesome happy its,9
a lady at the bi mart just gave me a up right freezer i pick it up tomorrow happy,9
a lady at the bi mart just gave me a up right freezer i pick it up tomorrow happy,9
happy friday rt xxxxx,9
hey kindly help me spread my new single to your amazing fans i believe they will love it happy thankyou ht,9
happy blondie happy love life,9
the downside to working in hr you re not allowed to have a bad day everyone else can but if you do you get cal,9
guess what we ve met the high standards of bbb accreditation is now part of an elite group of b,9
got my first paycheck today happy,9
adopt dont shop happy update from pablo ex bonus and lilly ex kim how heartwarming to see our boy who was so sad and,9
mtb new mirror purchase from diy complete before the rugby happy days winch combe cotswolds,9
life is as it should be stars are aligning god is good thankful happy,9
tgif from amp all medical all medical personnel amp t gif happy friday fun beanbags unification,9
meal out for mama s birthday birthday meal tapas family sisters mum happy love,9
our new home sweet home happily ever after us fiance more weeks home our house happy,9
tom bought me a balloon to cheer me up balloons depression sucks anxiety happy feeling loved,9
happy kava friday kick off the weekend with 2 off each cup of kava tea of the day all day,9
adopt dont shop happy update from pablo ex bonus and lilly ex kim how heartwarming to see our boy who was so sad and,9
g m f 63 happy friday lovelies we need 2 lighten things up a bit there s a segment on a radio show here in the state s called t,9
surfing anything that makes you this happy should be practiced daily think of it as personal training but on,9
happy friday high day from steve french and i 1 marijuana has intoxicating,9
pal my ott b of 4 months enjoying his new life playing in a rain puddle every horse deserves a happy life life after ra,9
checking out some artist pitches today with the family and i couldn t have been more happy we re eve,9
hey abaga please help me spread this to your amazing fans i believe they will love it happy thankyou,9
i need my nude time nude nudist nudism naked nudity naturism naturist bare nude beach f kk freedom happy top l,9
home water purification systems water right blog water clean water gibby the fish,9
adopt dont shop happy update from pablo ex bonus and lilly ex kim how heartwarming to see our boy who was so sad and,9
dastar life is what u make it accapella via da star says singer netherlands,9
find your happy follow it,9
fewer the necessities better your life will be dada bhagwan happy joy,9
cristian vlad happy thursday,9
give your love flowers that last a lifetime beautiful handmade quilts m inky blanket wedding anniversary happy eas,9
whatsapp mac abe o joya s 3106808424 love inst a good me t bt cute follow follow me photo of the day happy,9
adopt dont shop happy update from pablo ex bonus and lilly ex kim how heartwarming to see our boy who was so sad and,9
uniqueness happy one minute motivation with me via happy indeed,9
happy one minute motivation with me via happy indeed,9
hey abaga please help me spread this to your amazing fans i believe they will love it happy thankyou,9
h getting our happy on just dance 2 0 1 8 live now on,9
friday feeling happy spring is in the air nothing like a fresh wardrobe to welcome it in stock up on new arrivals,9
mad as hell i didn t know rush hour is coming back jackie chan and back together on the big scree,9
getting our happy on just dance 2 0 1 8 live now on,9
hey abaga please help me spread this to your amazing fans i believe they will love it happy thankyou,9
hey kindly help me spread my new single to your amazing fans i believe they will love it happy thankyou ht,9
like game of thrones like like daenerys like sixth scale figures gad just check out this revi,9
are you happy at work,9
happy sunshine yday t gif see you 4 on ab q new mexico,9
i haven t worn my spanx in a week keto ketogenic cross fit healthy happy,9
happy sunshine yday t gif see you 4 on ab q new mexico,9
miss him king puppy puppies baby animals lurcher happy hound dog dogs dogs of inst agram blueeye s cute,9
adopt dont shop happy update from pablo ex bonus and lilly ex kim how heartwarming to see our boy who was so sad and,9
very true happy,9
13 my whole twitter feed rn is just politics guns and bad news let s start a happy thread post a photo of something that ma,9
our furie nd heidi is happy its fri yay woof pointer dog dogs pet pets animal animals,9
add your text to three happy easter yellow chickens iphone x case via b i phone,9
friday model actor singer dancer happy wellness peace love vegan entrepreneur,9
friday model actor singer dancer happy wellness peace love vegan entrepreneur,9
hey abaga please help me spread this to your amazing fans i believe they will love it happy thankyou,9
abraham lincoln said people are just about as happy as they make up their minds to be shifting our minds to happy yup mid,9
3 ingredient happy hour a juicy campari spritz lifehacker australia via happy,9
give your love flowers that last a lifetime beautiful handmade quilts m inky blanket wedding anniversary happy eas,9
today s positive affirmation affirmation affirmations positive affirmation positive affirmations mantra,9
happy friday from this devil aloha friday happy weekend,9
the best thing about libra is that they never change happy is doesn t mean forever cause there sad story when the happy is ending,9
happy whiskey friday everyone a liquor store was going out of business and a co worker picked,9
this state love tee is giving us summer vibes see ya till 5pm womens fashion oot d tx photo of the day,9
day 10 of 0 0 h a p p y d a y s and today the happiness is this amazing fishcake baguette easy food tasty nomomomom happy food in,9
to change your life change your habits eating right starts first tag someone who has helped you change your life,9
moments of reflection have led me to a place where i m not happy thinking about my life and,9
