do not get angry or frustrated or desperate or enraged or depressed or any such thing you are all e,12
sickening i hurt for florida later for the what if s and i know how they feel no you don t i can t imagin,12
this rainfall is a savage y fall when am in d club n when am home its hot like hell without no light angry,12
angry guy screws his gf in very rude manner portsmouth,12
silence is better when you re angry and frustrated reacting to it will fuel the pain,12
it s your smile which makes me cool and calm when i am sad or angry smile cool calm sad angry edits by birdies yo,12
disappointed w ur new hair policies if ppl cant understand the above below the chin they have issues,12
mt drama school audition tip see angry while you can it is a masterclass in monologue delivery from young actor,12
go and see this angry by philip ridley absolutely brilliant unconventional unexpected and raw,12
wanna come a blog from me q a photos live tweeting getting angry with philip ridley,12
i m gonna have to bang some cunt out tonight if he doesn t fuck off tired from work angry we will see,12
we need to start getting angry at the diet industry for the bait and switch just because you lose weight on a diet,12
angry guy screws his gf in very rude manner,12
billions of purple blistering balderdash angry,12
small successes the unholy horror weird creepy concept art cone pt design space shooter cowboy angry https https,12
angry people make the most mistakes d rmm fb,12
angry people make the most mistakes d rmm fb,12
to be angry is the world with publisher turns author has steadily declined over in an automated home and a japanese story tweet is,12
to be angry is to let others mistakes punish yourself to forgive others is to be good to yourself master chengy,12
billions of odd toed prize zapotecs angry,12
yes it is soooo bloody ridiculous i am so angry at the nra and their attitude to the nd amendment,12
new embroidery design angry predator machine embroidery design blue head animal nature wild angry hunting,12
22 i just have to say that you either ban a country or not the so called clean compet,12
upcoming angry by philip ridley is though,12
thousands of infernal blistering slubberdergullions angry,12
energysa jobs maybe your priority but if you continue to,12
thanks for making every day a living hell with your internet new router you gave us is crap and overall conne,12
wanna come a blog from me q a photos live tweeting getting angry with philip ridley,12
i need to get a dexa scan done for my son his coach is refusing to allow him back to training unles,12
4 fucking deputies cowering outside while children were killed do your job while another department had to go i,12
angry people make the most mistakes d rmm fb,12
so proud of completely phenomenal performance an in awe of your power also blew,12
go and see this angry by philip ridley absolutely brilliant unconventional unexpected and raw,12
angry people make the most mistakes d rmm fb,12
they freaking better be charged they should sit in jail for a very long time if not for the rest of their,12
i can t believe it pls let me know your opinions cos i m just not seeing another side to this everything april,12
boycott nra new ripe apples we don t want em green angry maga make apples green again,12
do not get angry or frustrated or desperate or enraged or depressed or any such thing you a,12
angry people make the most mistakes d rmm fb,12
so my landlord decided to cancel the internet service here without telling me so i got home today and met wi,12
do not get angry or frustrated or desperate or enraged or depressed or any such thing you are all educated s,12
blog 51 why do people get so very angry find out more at anger abuse childhood rag,12
the dance video that haunts my dreams india is confused angry wtf more cheese than a bollywood d movie,12
be angry about why assault weapons ban was allowed to expire why no ban bump stocks or high capacity magazines which are f,12
angry people make the most mistakes d rmm fb,12
,12
when you can t find a working hi liter angry hi liter epic fail,12
the faces of four guys having an epic time angry confused scared and constipated,12
angry people make the most mistakes d rmm fb,12
billions of blithering prize anachronisms angry,12
taking on a angry mike tyson impression hahaha i hope he done find me and right hook me mike for ever,12
angry people make the most mistakes d rmm fb,12
angry people make the most mistakes d rmm fb,12
shibley hi sarah how others have to deal with the system i do,12
angry people make the most mistakes d rmm fb,12
angry people make the most mistakes d rmm fb,12
angry people make the most mistakes d rmm fb,12
billions of odd toed prize balderdash angry,12
be angry about why assault weapons ban was allowed to expire why no ban bump stocks or high capacity magazines which are f,12
be angry about why assault weapons ban was allowed to expire why no ban bump stocks or high capacity magazines which,12
why does snap fuck up all the time angry snap chat,12
even if a fetus could scream bloody murder women who have been brainwashed would still murder it i live in a world,12
thanks for staying tweeting fiona stay angry,12
millions of miserable cushion footed vivisectionists angry,12
feeling a rant coming on unusual for me but i am feeling angry some people have pets they miss treat get run ov,12
for no reason the irresolute person gets sad and angry and easily looks after his own satisfaction barnabite fo,12
wanna come a blog from me q a photos live tweeting getting angry with philip ridley,12
wanna come a blog from me q a photos live tweeting getting angry with philip ridley,12
angry look of acp sir love this pic so much,12
ohmigawwwwwd why am i even surprised angry,12
synonyms of angry irritated resentful mad furious upset annoyed cross learn english ap rendering l s teach,12
g m f 63 hello lovelies listen there s a lot going on in the world that needs your attention things that should make you angry,12
what does the bible mean when it says be angry sin not here s a short podcast to help understand it,12
transferred 100 of my data into a new phone they replaced 6weeks ago charged 125 the new phone was defectiv,12
the sound engineering is awful the singing is barely audible over the ridiculous thumping bass angry,12
words from tongue can prove the personality and character of a person some words can console others and some can,12
for the 2nd month running you have missed but collected all neighbours glass recycling does someone ne,12
looking at this time line its hard to say the issue is gun control the bso fbi law enforcement dropped the ball,12
the dance video that haunts my dreams india is confused angry wtf more cheese than a bollywood d movie,12
the dance video that haunts my dreams india is confused angry wtf more cheese than a bollywood d movie,12
the dance video that haunts my dreams india is confused angry wtf more cheese than a bollywood d movie,12
blog 51 why do people get so very angry find out more at anger abuse childhood,12
the dance video that haunts my dreams india is confused angry wtf more cheese than a bollywood d m,12
synonyms of angry irritated resentful mad furious upset annoyed cross learn english ap rendering l s teach,12
it s common sense logic that angry drinking gun owners the nra s base perpetrate the usa s rampant widesp,12
what is wrong with people taking advantage of someone so pissed i was duped by an impersonator,12
this makes me so angry it is not the same as diet coke it s just so disgusting dietcokegb,12
i m angry with you angry acting mad fru stated musically shiva mb halla,12
wanna come a blog from me q a photos live tweeting getting angry with philip ridley,12
2 30 hrs flight delay all messed up khi tod xb upset angry,12
oprah knows exactly how to deal with angry trump tweets disengaging from a rage fueled tweet just made my o,12
2 30 hrs flight delay all messed up khi tod xb upset angry,12
i agree in il s 6th district where 7 dems are in the primary inc my fave owner of anderson,12
when one reservations rep says something isn t possible that i ve done before and costs me money angry delta airlines,12
synonyms of angry irritated resentful mad furious upset annoyed cross learn english ap rendering l s teach,12
the press does make me angry saying kept his illness secret a secret from who medical history is,12
parents can be such fuckers i didn t mind me getting it tough but realising my long lost junior siblings had and a,12
last night was a movie but it felt like a dream to only wake up to see this shit was reality feeling emotional angry sad upset,12
no greater heartbreak than an early start 4 hours drive finally allowed to stop for a and it s clo,12
synonyms of angry irritated resentful mad furious upset annoyed cross learn english ap rendering l s,12
thursday a time when this world needs love peace and harmony and do something about guns in the hands of the angry,12
check angry birds maker craters on bad guidance losing half its market value via,12
not getting enough sleep and being hungry are the two main reasons for being angry,12
not getting enough sleep and being hungry are the two main reasons for being angry,12
our swamp is the great australian bight all the public sector arseholes sucking on the teat of the taxpayers an,12
amnesty international angry speech normal for some leaders voice of america angry,12
amnesty international angry speech normal for some leaders voice of america angry,12
watched my boy smash the hell out of angry last night such a raw energetic visceral performan,12
tell yourself that it is perfectly human to feel hurt angry and miserable both pleasure and pain are an in,12
you re a murderer nra s dana loesch accused of being a murder repeatedly during cnn town hall cnn angry dem,12
for anyone with children or who work with young people this is an interesting read w,12
having one of your members of postal staff signing for my post is completely unacceptable,12
g m f 63 hello lovelies listen there s a lot going on in the world that needs your attention things that should make you angry,12
give yourself the gift of forgiving others staying angry is like poisoning yourself hoping,12
i ve emailed head office with the details im fully aware of where it stops and doesn t it s oppos,12
watched my boy smash the hell out of angry last night such a raw energetic visceral performance judas got skills,12
when kids get angry this can help angry kids feelings emotions,12
you know what is not normal if little dirty pets got angry tha blow da mind yup,12
you know what is not normal if little dirty pets got angry tha blow da mind yup,12
drama school audition tip see angry while you can it is a masterclass in monologue delivery from young a,12
we don t want this and we certainly cannot afford for you to sue the nhs when you don t get your way angry,12
angry birds maker craters on bad guidance losing half its market value technology security news,12
marco rubio was repeatedly humiliated at cnn s gun control town hall the florida senator was confronted by,12
upcoming angry by philip ridley is,12
2 30 hrs flight delay all messed up khi tod xb upset angry,12
allah boobs inviman lies zhu x skrillex x they working for it that s my secret i always angry hul,12
running miles daily until i m no longer bored or angry,12
i have demons all around me pulling me down they are trying to drown me i can t make a sound lord i need you mo,12
maybe if i sleep more hours i ll wake up less angry,12
the exact moment my son realized he is now a middle child angry kid why me priceless,12
angry birds maker rovio s stock price drastically went down after their latest quarterly earnings report painted a,12
g m f 63 hello lovelies listen there s a lot going on in the world that needs your attention things that should make you angry,12
gop doesn t care about you they only care about power money and greed angry,12
2 30 hrs flight delay all messed up khi tod xb upset angry,12
angry why did this guy throw up in my car los angeles california,12
the exact moment my son realized he is now a middle child angry kid why me priceless,12
the exact moment my son realized he is now a middle child angry kid why me priceless,12
she was so little but so angry t bt tb thursday fms pad fms little feb 2 0 1 8 feb 2 2,12
my child won t talk to me here s what you can do to change it all behavior angry kids sad coping,12
my child won t talk to me here s what you can do to change it all behavior angry kids sad coping,12
when we are happy we listen with our hearts when we are hurt and angry we listen with our ears d ridgley,12
i just want to get paid for the work i ve done is that asking too much fuck no first world problems working stiff pissed angry,12
miss u my frend angry kha gayb ho itne dino se,12
here i am struggling to speak french its not among these angry yohhh i need motivation to learn chinese,12
angry with your cablet v provider for expensive bundles phone cable internet and bad customer service get,12
burdett did you figure out why they are so angry crossroads,12
thousands of profiteering dunder headed ostrogoths angry,12
g m f 63 hello lovelies listen there s a lot going on in the world that needs your attention things that should make you angry,12
angry birds maker craters on bad guidance losing half its market value angry birds r ovi o tc,12
ummmm where are you angry,12
thousands of profiteering certified pirates angry,12
tw sexual assault what i m angry about today sexual abuse and violence against queer men is real and that is,12
back at the tonight for the alternate version of s angry,12
huge congratulations to all of the angry company wonderful performances by,12
i have no idea where rudy s 60 pounds of dog food is says it was delivered yet no where to be seen angry,12
2 30 hrs flight delay all messed up khi tod xb upset angry,12
so angry about this disgrace to the shield the job and all who have gone before parkland,12
what was he afraid of how about the three teachers that gave their lives protecting those kids he was,12
cartoons didn t prepare me for this funny birds nature snow mouse rat rodent animals me me l mao lol,12
cartoons didn t prepare me for this funny birds nature snow mouse rat rodent animals me me l mao lol,12
cartoons didn t prepare me for this funny birds nature snow mouse rat rodent animals me me l mao lol,12
cartoons didn t prepare me for this funny birds nature snow mouse rat rodent animals me me l mao lol,12
nathan what happens physically and emotionally when you are angry,12
tell to replace mccain already she s the worst everyday angry shout y pouty acting a damn fool in,12
what happens physically and emotionally when you are angry,12
clash royale angry chiefart version,12
troubled waters activities for angry worried kids activities you can do now,12
unbelievable once again native lives do not matter angry no justice,12
this is one angry boi if ya ask me why is he so angry is it because he s only a head and shoulders find out pro,12
it s bad getting worse we the majority of reasonable americans are frustrate,12
huge congratulations to all of the angry company wonderful performances by,12
g m f 63 hello lovelies listen there s a lot going on in the world that needs your attention things that should make you angry,12
my review of angry at georgie henley tyrone huntley well and truly nailing it,12
g m f 63 hello lovelies listen there s a lot going on in the world that needs your attention things that should make you angry,12
old 2 jags still looks like he s game to throw a couple of punches angry bbc qt,12
yas yas yas in angry tonight i think i stopped breathing with you in the end tell phil,12
it s almost time for my favourite part of the week time to get drunk and angry watching bbc qt,12
mt as i said in my review for angry is a 5star evening with perfect performances from,12
this latest kidnap really hurt now all it is obvious boko haram understands how to fight this war just focus on t,12
never using azoresairlines again i booked 3 flights with them and they changed the middle one to a day earlier wh,12
angry a stunning monologue masterclass from and also from,12
oooh shouty mc shouty face angry,12
huge congratulations to all of the angry company wonderful performances by,12
huge congratulations to all of the angry company wonderful performances by,12
angry of how we punish the law abiding productive patients doctors in order to protect people who may have serious a,12
2 30 hrs flight delay all messed up khi tod xb upset angry,12
if you can t handle competition do better rather than go under to damage other sellers to win the market i bet som,12
ok so i am pissed how dare you pretend to be in the military to con people you are a piece of shit men and women,12
when you buy a new oven glove from and 3 hours later you badly burn your fingers getting your dinn,12
i think he may have been upset at me lmao angry,12
g m f 63 hello lovelies listen there s a lot going on in the world that needs your attention things that should make you angry,12
help angry kids by giving them tools to manage anger parenting ece psych,12
mt as i said in my review for angry is a 5star evening with perfect performances from,12
as i said in my review for angry is a 5star evening with perfect performances from,12
is it good to sleep when angry good sleep angry,12
my mother uses an extraordinary amount of exclamation marks on her texts excited angry,12
the think i ve notticed since dodger joined is you become a villain if you say anything bad against th,12
new angry coffee sun tired monday morning good morning wake up sunshine mondays sunrise grumpy caffein,12
back at the tonight for the alternate version of s angry,12
anger is an opponent linguistics poetry linguistics poetry art angry opponent anger,12
angry eyes number one series people in the,12
is live 2 5pmet with and coming up talks angry plus b,12
bitter table for one i don t think there are enough angry old white guys to justify your exist,12
excited to watch with and lovely guest this eve in angry,12
huge congratulations to all of the angry company wonderful performances by,12
a blog from me q a photos live tweeting getting angry with philip ridley,12
thanks for staying tweeting fiona stay angry,12
park so what makes the team angry people who talk in the cinema intentional ignorance,12
is live 2 5pmet with and coming up talks angry plus b,12
do you know how to help your angry child,12
going to see the flip reverse of angry tonight very excited to see do air such beautiful writing,12
a blog from me q a photos live tweeting getting angry with philip ridley,12
is live 2 5pmet with and coming up talks angry plus b,12
is live 2 5pmet with and coming up talks angry plus,12
wondering why your driver chose to drive straight past me tonight on barnsley road scaw s by he,12
i get angry at games anger mgmt anger management anger management class smart self,12
g m f 63 hello lovelies listen there s a lot going on in the world that needs your attention things that should make you angry,12
g m f 63 hello lovelies listen there s a lot going on in the world that needs your attention things that should make you angry,12
anyone else notice that people are really pissed off today in nyc i take it that it must because of the weather,12
ur website has wrong opening hrs for 207 leith walk now it s going to be 8 days until i can,12
looks surprised looks happy looks excited gehrke,12
flora hope this can be worked out quickly that you get coverage soon frustrated angry punch someone,12
park okay everybody i will be live tweeting s post show q a for the world premiere of philip ridley s angry,12
beyond shocking angry whilst sad,12
anger outburst anger mad madness angry outburst life volcano mood procreate creative crea tie f add,12
she s now blaming herself saying it s my own fault i ve looked after him too well now he s big and strong and to,12
g m f 63 hello lovelies listen there s a lot going on in the world that needs your attention things that should make you angry,12
child are bought and sold working all day they can t even taste the chocolate annoying mad angry,12
there are so many things going wrong in the world how do we correct them where do we start and whom do we trus,12
to tonight for angry with philip ridley s words produced by,12
not a single new yorker i ve passed had checked the weather this morning cold angry teased,12
mein three words beyond fed up seriously fuck my like with a serrated spoon right now angry,12
so angry that you don t speak or hear from any educational staff with regards to my special needs,12
one of our child s initial symptoms of juvenile depression was an increased frequency of angry emotional,12
g m f 63 hello lovelies listen there s a lot going on in the world that needs your attention things that should make you angry,12
a blog from me q a photos live tweeting getting angry with philip ridley,12
you know nothing of the slap fairy receiving great feedback from the new episode where we are joined by gregs go,12
pardew i am angry about the incident pardew angry town,12
how can zero tolerance against guns not be the answer will no one listen how many more children must be killed,12
i tried to watch and got so angry at him telling me who i hate and what i m really trying to do i had,12
a person who is angry tends to place more blame on another person for their misery,12
okay ive had enough of this stupid update i cant even figure out how to get to my friends list to del,12
a new rory s review is now live go check it out what a british chef thinks about america beloved food you tube angry,12
2 30 hrs flight delay all messed up khi tod xb upset angry,12
hello lovelies listen there s a lot going on in the world that needs your attention things that should make you,12
angry of how we punish the law abiding productive patients doctors in order to protect people who may have serious a,12
the bbc is imposing another licence fee hike yet again this year i am outraged and astonished that such a biased o,12
angry of how we punish the law abiding productive patients doctors in order to protect people who may have ser,12
original art o oak a rosie rosie odonnell lesbian abuser bully spousal abuser child abuser abuse ugly,12
miss u my frend angry kha gayb ho itne dino se,12
so disappointing and unacceptable of for canceling and changing our flight 3 times yesterday with delays and,12
an angry person tends to anticipate other events that might cause them anger,12
mindblown go see angry by went to see it last night and still buzzing,12
new video out now when a rapper gets mad rappers angry angry rappers,12
if anyone even breaths next to me today i will bite them angry,12
i can t be this fear monger war monger is allowed to go get free reign to spew propaganda,12
this is horrific listening to how some ignoramus with a pram took his phone out to photograph janine,12
a blog from me q a photos live tweeting getting angry with philip ridley,12
2 30 hrs flight delay all messed up khi tod xb upset angry,12
when we are happy we listen with our hearts when we are hurt and angry we listen with our ears,12
2 30 hrs flight delay all messed up khi tod xb upset angry,12
2 30 hrs flight delay all messed up khi tod xb upset angry,12
care will be making a complaint as this is complete unacceptable over 3 hours for someone to come to me,12
repost halaandhyacinth because sometimes what a dreary thursday needs is an angry black cat,12
1 8 robot icon by,12
i think i need a new gpu i streamed for nearly 4 hours and dropped this many frames angry,12
a blog from me q a photos live tweeting getting angry with philip ridley,12
billions of thundering blue bottomed vivisectionists angry,12
if anyone even breaths next to me today i will bite them angry,12
a blog from me q a photos live tweeting getting angry with philip ridley,12
angry scared confused self described by kasky this is why i don t ask teenagers for advice if bann,12
imagine a world where our hearts broke for each other imagine a world that loved each other can we just have a ta,12
2 30 hrs flight delay all messed up khi tod xb upset angry,12
2 30 hrs flight delay all messed up khi tod xb upset angry,12
thursday a time when this world needs love peace and harmony and do something about guns in the hands of the angry,12
thursday a time when this world needs love peace and harmony and do something about guns in the hands of the,12
a blog from me q a photos live tweeting getting angry with philip ridley,12
you know what is not normal if little dirty pets got angry tha blow da mind yup,12
you know what is not normal if little dirty pets got angry tha blow da mind yup,12
you know what is not normal if little dirty pets got angry tha blow da mind yup,12
you know what is not normal if little dirty pets got angry tha blow da mind yup,12
you know what is not normal if little dirty pets got angry tha blow da mind yup,12
you know what is not normal if little dirty pets got angry tha blow da mind yup,12
you know what is not normal if little dirty pets got angry tha blow da mind yup,12
2 30 hrs flight delay all messed up khi tod xb upset angry,12
angry holebas to explode the bomb and fuel survival bid hole bas angry explode,12
i am sad for this dad that has to experience this tragic loss i would be pissed upset and angry also he hel,12
angry birds game maker hit by worst stock sell off since going public breaking news,12
thousands of odd toed dunder headed anthracites angry,12
2 30 hrs flight delay all messed up khi tod xb upset angry,12
mindblown go see angry by went to see it last night and still buzzing,12
a little early but i think i ll make a coffee teeny an angry coffee teeny national margarita day,12
2 30 hrs flight delay all messed up khi tod xb upset angry,12
are you americans angry over the atrocity that happened in florida good never forget do not backdown speak up,12
