news flash tv news god i hate those frickin zombies they keep eating all my friends and family tune in,8
hate my story how do we forgive love hate forgiveness recovery mental health ok to say lgb t q karly leto mms,8
you are not a best friend if you both don t hate each other when youmeet at the first time,8
hate crime sgt today received refresher training on modern day slavery excellent session thanks well done to tra,8
loads of snow due next week no i m so done with this cold winter winter stv weather snow cold hate,8
self tape on the loo this is new it s ok i m waiting on a pregnancy test result actor manchester,8
they miss the greatest commandment read the blog post at religion church love hate,8
mal aka so ros hate traitor sho ing the market pos liberal loser anti fa sucks vote rid,8
guidelines for countering online hate speech hater hate he jt mow ani ena wi ci dz ien nika rs two journalism media https,8
the man is representing america people what the hell have you done trump hate idiot,8
disgusting human being who has no relationship with the truth trump con man hate,8
anyone else notice trump cpa c 2 0 1 8 using music to promote hate gun violence discrimination arming tea,8
it appears logic and commonsense are relative to one s intelligence a difference of opinion is not hate,8
fun fact feminism has never meant hating masculinity to me i m a gay male i love men i see power in both energ,8
media circus is all cnn is the hate and divide they spew is really special,8
wow the amount of hate coming from twitter advertising is simply incredible blocking all advertisement after,8
anyone else notice trump cpa c 2 0 1 8 using music to promote hate gun violence discrimination arming tea,8
msm you need to call out cpa c 2 0 1 8 for what it is a hate group hate speech,8
people have way to much time on their hands how can find the time to hate the worlds would be such,8
friday feeling friday motivation friday morning biggest lesson i ever learned is get rid of any hate that you have in your heart and soul,8
the never trump never stop spewing their hate cpa c 2 0 1 8 the snake,8
the never trump never stop spewing their hate cpa c 2 0 1 8 the snake,8
the number of hate groups has increased across the united states florida,8
i don t hate uhuru but raila s friend mag u ful i now confesses as the two meet in kampala to iron out,8
hate 2018 s biggest trend introduced by a humanoid advertising creative marketing hat eiss o 2 0 1 8 hate 0 1 8,8
it s sad that our president can t even honor a great christian leader with kind words without hate,8
msm you need to call out cpa c 2 0 1 8 for what it is a hate group hate speech,8
the never trump never stop spewing their hate cpa c 2 0 1 8 the snake,8
cnn breeds hate with those rhat listen to their fake news biased against support nra,8
anyone else notice trump cpa c 2 0 1 8 using music to promote hate gun violence discrimination arming tea,8
friday feeling stay strong resist the hate vote the creeps out,8
the assassin s illusion an essay about pulse nightclub tragedy lgb t q violence hate acceptance love recovery,8
sora bhp ant shares some insight on receiving hate on twitter it s rare for me to get constantly good feed,8
discusses hate speech freedom of expression it s about degree of civility respect debate you can,8
tybalt i hate romeo hate,8
in this time of crisis sadness tragedy trolls prove again they never take time off l,8
new twitter rules for fighting hate and abuse via news msnbc wap o nyt wsj bbc,8
anyone else notice trump cpa c 2 0 1 8 using music to promote hate gun violence discrimination arming tea,8
anyone else notice trump cpa c 2 0 1 8 using music to promote hate gun violence discrimination arming tea,8
if it hasn t happened to you yet consider yourself lucky it s not a matter of if it will happen but rather a,8
i still get disturbed by few voices hate them pn,8
anyone else notice trump cpa c 2 0 1 8 using music to promote hate gun violence discrimination,8
it s logical that dumb ignorant americans continue to entrust their lives to the pyramid scheme,8
tonight marquee theater cru emus uc vn coc music fight hate beauti f fully broken,8
florida tragedy has exposed how extensive right wing madness is this vile thing call dana losech the disgusting dis,8
tonight marquee theater cru emus uc vn coc music fight hate beauti f fully broken,8
and he hasn t so far through thick and thin he s fought to do what s best for the american people d,8
i hate instagram ads hate inst a ads,8
msm you need to call out cpa c 2 0 1 8 for what it is a hate group hate speech,8
us olympic skier lindsey vonn to trump trolls i never expected that much hate from fellow americans,8
msm you need to call out cpa c 2 0 1 8 for what it is a hate group hate speech,8
live the life for urself dont sabotage others cause u failed open ur own doors and stop walking into someone el,8
msm you need to call out cpa c 2 0 1 8 for what it is a hate group hate speech,8
plays msp aha ive been there for 10000000 times hate is that supposed to make sense why re you hat,8
remember a sikh man is brown skin in this racist society why not have the white man model your religious head wear,8
aha ive been there for 10000000 times hate,8
protect dreamers other immigrants from trump s hate add your name to the discharge petition to force a vote on,8
this weather got everyone sick lol hate,8
cough you re not a girl and they can be boys watching this shit hate,8
us city faces lawsuit after banning pride march mississippi pride lgb t hate,8
us city faces lawsuit after banning pride march mississippi pride lgb t hate,8
this is what hate looks like this is what the unregulated sale of guns lookslike this is what homegrown,8
us city faces lawsuit after banning pride march mississippi pride lgb t hate,8
if they follow their faith faithfully they have to be terrorist they are commanded to be terror,8
why exam are in the marriage season its so loud outside hate marriage hate exam hate people,8
true insist we stop the hate in politics just fix the law and go forward stop the hate and the,8
spoken like a troll democrat with no heart hate will never help hate and grudge shot killed the students because,8
ssstar party of hate this teacher did nothing to help nick cruz for 3 years,8
alas i offer cassandras prayer i am truly blessed to be bestowed with great gifts and yet com,8
out of the frame love hate desire as msg ian 1 s pub ia rtg kindle ibook s kobo nd,8
oh he s white hate,8
sometimes i think his off the cuff remarks will be exhibit a z at his federal trial for collusion a,8
the spiritualist brings you psychic gossip from hollywierd bf meme from cpac,8
donnie is proving there is such a thing as mentality illness yes there is als,8
do you hate people i don t hate them i just feel better when they re not around c b,8
meanwhile has hit 50 approval while your network sponsors a hate rally with scripted que,8
loving your wife don t speak or act in ways that might embitter cause her to become angry hostile don t intenti,8
send custom and anonymous comments on inst agram and face book and boost them into the spotlight contact us for,8
riding the j train and it s going smoothly thank you mta have a good friday nyc now playing indi ku t,8
the hate journey the love journey you choose,8
gaurd your ear gate in comes junk out goes junk in comes love and peace out goes love and peace friday feeling,8
my allergies have been going off all week i guess i m just allergic to tucson hate,8
should read russian puppet speaks to group of unethical immoral heartless so,8
i stand with emma never again donnie and his cronies are terrified of truth which is why they a,8
sure wish would at least try to help america and stop from spreading hate,8
live stolc calm when people don t love you any more on s pre aker anger hate love need opinion,8
recipe for global coup d etat government 1 control monetary system apply debt 2 sow seeds of hate 3 maintain,8
sure wish would at least try to help america and stop from spreading hate,8
america sheldon adelson now you know sponsure hate us to move embassy to jerusalem on may 14 day of independe,8
discusses hate speech freedom of expression it s about degree of civility respect debate you can,8
what is wrong with people i just witness a man driving over a bird he diden t even slow down a sec i will ne,8
worldwide information blogger luc s chr ij vers watchdog says trump inspired even more hate groups,8
the 1 s t century war is not the answer greed war hate must be overcome friday thoughts,8
friday motivation friday feeling love hate big ego loser women always need attention that s a given but just ho,8
like your father trained you well to hate your fellow human being o losh o oshi idiot of the highest order,8
love is a cycle when you love you get hurt when you get hurt you hate when you hate you try to,8
mal aka so ros hate traitor sho ing the market pos liberal loser anti fa sucks vote rid,8
i hate the terrible ads i have been getting on lately i don t want politics in my ads especially extreme,8
recipe for global coup d etat government 1 control monetary system apply debt 2 sow seeds of hate 3 maintain,8
have you been the victim of a hate crime and had nowhere to turn afterwards after hate have the information and s,8
youhadonejob1 ill it er hate ear responsible,8
today s blog is about hate and the generation x files,8
we should have started protecting our children from angry people way back when not everything is mental illness,8
calling all people together we can solve these crises refugees policy poverty,8
hate if you look up and read work from wilfred bion a british psychoanalyst and innovative thinker he makes a,8
french far right leader marion le pen attacks gay families in address to supporters at cpa c hate,8
tsas junior affiliates looking to learning more about countering preventing and combating online hate speech check out,8
tsas junior affiliates looking to learning more about countering preventing and combating online hate speech check out,8
police race hate islam muslim and yet if an idiotic white guy throws,8
spiritual readings can help guide you to put your past behind call now sagittarius,8
during a reading sagittarius cancer pisces gemini aries taurus fortuneteller,8
2018 sick person money means more to than lives turning what you cannot defend on the media,8
so i saw this hmmm intolerant hate how long will this stay up,8
i thought that a ash iq bana ya aap ne new version is worse song recently created but naam haim era it s even worst kya h,8
hate never wins the war but they do win battles squash hate speech hate crime bigotry every chance you get hate gro u,8
i hold the nra in contempt for twisting the 2nd amendment and hijacking our government to further,8
amnesty international slams trump s hate filled rhetoric via,8
we take the hoods and masks off the history of the kkk what did we find lots of hate and a lot more listen,8
google search tattoo love tattoo life dont chase people chase dreams thc 2 0 love hate,8
yoda says fear is the path to the dark side fear leads to anger anger leads to hate hate leads to suffering,8
hate is a cancer on one s soul frank sonnenberg hate,8
hate never wins the war but they do win battles squash hate speech hate crime bigotry every chance you get hate gro u,8
hate it so much wish it never existed hate cancer,8
black namaste white violent smile writers poet writer spoken word love hate 12,8
hate never wins the war but they do win battles squash hate speech hate crime bigotry every chance you get hate gro u,8
hate never wins the war but they do win battles squash hate speech hate crime bigotry every chance you get hate gro u,8
hate never wins the war but they do win battles squash hate speech hate crime bigotry every chance you get,8
best one yet tattoo love tattoo life dont chase people chase dreams thc 2 0 love hate,8
things that you get when you never expect it love hate things that you don t get when you expect it love,8
out of the frame love hate desire as msg ian 1 s pub ia rtg kindle ibook s kobo nd,8
sometimes when people talk i just want to punch them in the face things i cant accept people relate able hate why i need peace and quiet,8
partisan media has been smearing for a decade does brian feel hate based cdn media,8
only pathetic people will use u n cowards will not tell u the truth hate,8
meera if you hate someone you cannot grow so you must change the hate into love if you have negative feelings you are not,8
meera if you hate someone you cannot grow so you must change the hate into love if you have negative feelings you are not,8
black namaste white violent smile writers poet writer spoken word love hate 12,8
if you hate someone you cannot grow so you must change the hate into love if you have negative feelings you a,8
black namaste white violent smile writers poet writer spoken word love hate 12,8
you ll get 10 free lyft rides w this code lyftlush hate going in cabs euphoric riotous,8
do not hate people rather hate the systems that make them less than human hate is a survival mechanism,8
now you know maga ts who is feuling some of the hate in america sheldon adelson offers to help pay for jerusalem embassy,8
what swd decks do you hate to see acrossed the table or on tts and why mine is 7th sister builds for sure hate sw destiny,8
i love you too sarah and i m making it safe to hate again on the generation x files,8
a church that showed their hate in a funeral read the blog post at hate love,8
now you know maga ts who is feuling some of the hate in america sheldon adelson offers to help pay for jerusalem,8
hate consumes you biggest racist on twitter,8
if you don t love her or hate her yet you will you tube subscribe mis squantum christmas tr,8
texas has more active hate groups than any other state according to civil rights group,8
gop evil men are filled with hate are destroying america intentionally shame on them vote them out,8
probably not especially supportters maga ts white supremacist nazi,8
it won t work your public display of hate why we gotch a hey kids you re being played,8
if you don t love her or hate her yet you will you tube subscribe mis squantum christmas tr,8
i am horrified by everything being said hate liars murderers gop nra killing children,8
if you don t love her or hate her yet you will you tube subscribe mis squantum christmas tr,8
sheridan this orange nun is what unionism calls british culture its summer long 16th century antipopery hatef,8
do you hate your acne we have just what you need skincare beauty save follow,8
hold up i feel like i know this guy from somewhere exposed help who morning me me funny m emes good fresh,8
tuscany yes an armed person stood outside and did nothin,8
hate being sick,8
it s the mo of liberals hate hatehatehate hate hate hate hate hate n,8
i fell in love with you because you loved me just when i hated myself love hate life,8
promotes hate violence racism a hateful being,8
heaven only knows tattoo love tattoo life dont chase people chase dreams thc 2 0 love hate,8
recommended article very interesting results gt first person shooter players tum b lr users were less likely to pr,8
watch your favorite show laado 2 every monday to friday at 9 00 pm only on h now entertainment h now indian,8
here s an honest question for you rancid diseased females trannies on drugs hu ing men for rejecting your,8
gib z erz hate gib z ers the less of them gib z ing the more for the likes of,8
thanks kukshiwala i was expecting a reply from them these people a,8
even the world s biggest hate machine life comes to an end everything has an s curve but what is next,8
if one can love the same can hate too,8
by your logic we should just lie down and let islamic extremist terrorists do whatever,8
right wing talking heads are smearing the parkland survivors gop corruption gop enablers fascism hate nra russia t ru,8
is causing a storm in their lgb t q friendly advertising marketing campaign about not,8
had girlies in girdles weighing more than they supposed ta poser no sir my hustle so russell i stretch work yoga hate,8
update i hate leaving on such a cliffhanger all kidding aside great show,8
this is what chaos looks like dems favorite state of confusion disorder instead of lifting up the her,8
right wing talking heads are smearing the parkland survivors gop corruption gop enablers fascism hate nra russia,8
right in the thick of it i created a r sum after to send t,8
new video ale things i love hate about my favorite you tubers,8
squirrel inc1 i may be here or busy enjoying my positive optimistic life,8
she was a no win situation love hate experience poem poets of inst agram poetry,8
but jeremy it s not fair bc we so the men aren t allowed to fuck who they want w o you pai cip ating or,8
trump cnn the piece both sides really hate phoenix rally msm cnn fake news t cot,8
we don t like you hate hate pari should be flop,8
black namaste white violent smile writers poet writer spoken word love hate,8
i hope everyone at the cook off is late to work tomorrow petty johnson petty wap hate player hater of the year,8
in this era we care more about our money than our children about success than distressed and having anti hate gro,8
out now linkin bio you tube mo murder m gp money music my mix tape z spot ify self paid spin rill a love hate hip hop htt,8
hate is being repackaged under patriotism be wary of the repackaged hate speech for it shall pervert your dignity hate di,8
if you can t love that s mean you can t hate hate love,8
help is a pain in the neck pub g pub g cheater cheater hate no fun fort nite ban all cheater pub g life,8
tired why so many work to do smh s mh hate rush,8
is it better to give or receive who the fuck knows love hate indifference experience,8
human rights waning around world people speaking out demonization hate repression ethnic cleansing me too,8
if u pause your speech word love u spoke u can look into your eyes see they are undeniably f,8
dating in 2018 love hate dating tattoo experience poem poets of inst agram poetry,8
hate is too great a burden to bear it injures the hater more than it injures the hated coretta scott king,8
out of the frame love hate desire as msg ian 1 s pub ia rtg kindle ibook s kobo nd http,8
out of the frame love hate desire as msg ian 1 s pub ia rtg kindle ibook s kobo nd,8
crisis actors really that s a new low the only crisis actors such an insensitive thing to say about kids t,8
jeremy we just wanted to show everyone what you could do you didn t think i d get sick of the luxurious accommoda,8
discusses hate speech freedom of expression it s about degree of civility respect debate you can,8
discusses hate speech freedom of expression it s about degree of civility respect debate y,8
terrence those students cant even think for themselves socialist cnn with they fake news hate agenda always sprea,8
how u dodge the hate lol too funny foh,8
hate new snapchat just saying,8
i ve loved being on for a long time i find so many articles of interest to me but i m not happy with t,8
split personality out now on spot ify sound cloud hip hop rn b love hate music radio,8
t bt when spoke the truth from his heart regarding the lies and history with watch a,8
ya know when you really hate the constitution just bring up that slavery thing and discredit our founders all at once,8
shame on you pinki peerni u dint even think about ur family u dint think about the person wit,8
hate is a cancer on one s soul frank sonnenberg hate,8
have mercy upon me o lord consider my trouble which i suffer of them that hate me psalm 9 13,8
nice to see that stop funding hate s campaign has moved beyond hate directed at mass immigration muslim grooming gan,8
have mercy upon me o lord consider my trouble which i suffer of them that hate me psalm 9 13,8
have mercy upon me o lord consider my trouble which i suffer of them that hate me psalm 9 13,8
have mercy upon me o lord consider my trouble which i suffer of them that hate me psalm 9 13,8
strange how purveyors of hate seem to get away with it time after time,8
love ice cream hate not having ice cream the awesome people at nz have been giving away free ice creams,8
embrace the hate but for the love of god man make it look good like us the generation x files,8
you r one sick twisted people loving mass murder u really r a pathetic loser guns will never go,8
all of the pro gun arguments i ever hear are about teaching people love but no one ever explains why the hate,8
awaaz you have ma,8
sora bhp ant shares some insight on receiving hate on twitter it s rare for me to get constantly good feed,8
out of the frame love hate desire as msg ian 1 s pub ia rtg kindle ibook s kobo nd htt,8
out of the frame love hate desire as msg ian 1 s pub ia rtg kindle ibook s kobo nd,8
why are we punishing the poor for being poor the budget hurts the most vulnerable among us,8
a new low hate france,8
pathetic he breeds protesting division racism hate what a wasted 8 yrs he alone set usa back,8
lyricspage my hustle so russell i stretch work yoga hate,8
out of the frame love hate desire as msg ian 1 s pub ia rtg kindle ibook s kobo nd,8
she was born in america lives and trains in america but she is representing ohhh let s say switzerland hate hate olympics,8
honestly so done with my life self hate i hate life fuck people bad depression depressed depression quotes dep,8
send custom and anonymous comments on inst agram and face book contact us for details and go to our website,8
ars activists or radical vegans your lifestyle choice doesn t require u to be absolutely insensitive 2 your fellow,8
it s way beyond sad the leftists are pure evil they will sacrifice kids to push their ideology of hate power an,8
liberals hate children that s why they love planned parenthood which does no planning for parenth,8
s ogi 1 2 3 is a hate group for special interests,8
disgraceful the me too conversation erases trans people transgender lgb t lgb t q trans phobia hate,8
this is how the palestinians parents are teaching their children terror no wonder why they stabbi,8
this is how the palestinians parents are teaching their children terror no wonder why they stabbing innocent civ,8
nice to see that stop funding hate s campaign has moved beyond hate directed at mass immigration muslim,8
lyricspage my hustle so russell i stretch work yoga hate,8
my hustle so russell i stretch work yoga hate,8
disgraceful the me too conversation erases trans people transgender lgb t lgb t q trans phobia hate,8
please advise this guy who we are because apparently he doesn t know just yet he s a little late on the bus i,8
perfectly stated democrats hate,8
sora bhp ant shares some insight on receiving hate on twitter it s rare for me to get constantly good feed,8
love over hate,8
it s way beyond sad the leftists are pure evil they will sacrifice kids to push their ideology of hate power an,8
it s way beyond sad the leftists are pure evil they will sacrifice kids to push their ideology of hate,8
you are right but unfortunately don t know what is website he only know hate,8
don t you just hate people who spoil a great narrative,8
black namaste white violent smile writers poet writer spoken word love hate,8
license to discriminate georgia republicans want to give adoption agencies the right to turn away gay couples,8
head breaks silence to attack gun control advocates they hate individual freedom no,8
i m with u i know all about medicine biology it s serious kaw hi is not athe tyoe of person to lie,8
i m so sick of my teachers checking to make sure that i wrote the homework down in my agenda it s getting old swag hate school,8
what an evil despicable hateful disgusting thing to say it s people like her who are dividing this country,8
i cant read yahoo its full of hate bull yahoo very fake news,8
christ mother time mother time my first prayer of the day 20 20 please my refusal to forgive as,8
christ mother time mother time my first prayer of the day 20 20 please my refusal to forgive as,8
recipe for global coup d etat government 1 control monetary system apply debt 2 sow seeds of hate 3 maintain,8
christ mother time mother time 20 20 please cloak me and my projects 20 20 i m lookin to leave the mw subsys,8
perfect love hate indifference experience poem poets of inst agram poetry,8
we must be forgiving to each other for our misguidance lack of perspective and intolerance these behaviors are t,8
let s start here any institution proven to be professing hate should have all its pr,8
its 1 thing 2 have and express ur opinion but 2 attack a deceased minister 4 his religious beliefs is hate,8
had to add you to follow list weird i do have a few more followers after losing a few it s wild wha,8
i think he s mad he didnt think of it first keep up the hate insane bigot,8
in a world filled with hate and despair we must have hope and faith fight for unity and our pride remain,8
yoda says fear is the path to the dark side fear leads to anger anger leads to hate hate leads to suffering,8
congratulations on being an evil minded and cruel person lauren duc a billy graham liberal bigotry,8
herpes doesn t discriminate most people have oral or genital hsv stop stigma hate,8
do you hate people i don t hate them i just feel better when they re not around c b,8
nra chief says gun control advocates hate freedom but fails to address child survivors of florida shooting,8
holy fuck you have to see the anti gay sentiments people are spreading o o skip to 4 00 if ya want tum b lr s jw,8
trump s presidency fueled growth of us hate groups,8
i ve been inundated with messages supporting stand with janine it warms my heart when belfast comes together like t,8
new video ale things i love hate about my favorite you tubers,8
just picked up some gas fun today both great projects with bright futures block chain crypto coins,8
recipe for global coup d etat government 1 control monetary system apply debt 2 sow seeds of hate 3 maintain,8
