thread this is a well being apps thread helpful for anxiety depression self harm bp d and more i ve tried this,4
know a child who ssurvived a traumatic experience contact at 800 388 6247 kids children ptsd,4
people who don t have anxiety and ptsd what the hell do you even think about all day,4
dealing with what the body remember in anxiety attacks read the blog post at mind body thoughts,4
for introverts with anxiety this hits upon a salient point perfectionism and self consciousness largely occupy o,4
people who don t have anxiety and ptsd what the hell do you even think about all day,4
be a warrior not a worrier depression anxiety fear shame panic via,4
this mental trick is scientifically proven to reduce anxiety,4
how to reduce work anxiety healthyplace mental health mental illness anxiety,4
people who don t have anxiety and ptsd what the hell do you even think about all day,4
cbt bootcamp launches with their new cognitive behavioral therapy groups and their new logo moonlit media,4
what does anxiety feel like to you if you can relate art by,4
anxiety truth fact origins as a kid with anxiety disorders it was rare for me to have peace in my life i was blesse,4
three poems that helped me in tough times attention might trigger love is in da blog prompt 24,4
evaluate anxiety level of your child online screening test anxiety adhd parenting mental health,4
amy cuddy being nervous can make you more successful via business insider success anxiety,4
new post my experience in a e beech at teacup club,4
what does anxiety feel like to you if you can relate art by,4
what does anxiety feel like to you if you can relate art by,4
i think the stigma around antidepressants and mental disorders will get better in time people literally just don,4
recovery isn t only about mitigating symptoms of anxiety depression it s also about creating the best life we can,4
to heal anxiety you must embrace it fully with mindfulness compassion not avoidance aversion visit,4
practically perfect the series brings you practical ideas for supporting people with depression anxiety bipolar an,4
the connection between menopause and anxiety womens health,4
a kirschner another myth bites the dust tests and quizzes don t lead to test anxiety,4
food medicine for anxiety healthy food help 2 h e a l help2heal holistic health,4
psychological stress and anxiety as important as physical stress in immune response to exercise,4
that feeling that you re the only person awake and afraid and ashamed bp d anxiety mental illness,4
happiness is a conscious choice thursday thoughts depression anxiety wisdom joy,4
after a while i lost grip on the real world i m still playing catch up now unfortunately i was left scared with,4
this is my story mental health did c ptsd anxiety suicidesurvivor depression in cancer journe,4
in me all day every day depression anxiety mental illness end the stigma,4
i woke up with a headache again but i also woke up feeling excited it s the weekend for the first time in a l,4
did you know that 3 out of 5 doctor visits are due to work stress related illnesses health anxiety stress,4
me all day every day depression anxiety mental illness end the stigma,4
knowledge is power and prevention read my post on childhood anxiety anxiety c bt mental heal t,4
people who don t have anxiety and ptsd what the hell do you even think about all day,4
ptsd anxiety and depression doesn t only effect you god family are with you every step of the way here s,4
behavioral health economics comprehensive analysis of global data shows spending money to treat depression and,4
what does anxiety feel like to you if you can relate art by,4
first everything is fine then everything is bad anxiety panic,4
what does anxiety feel like to you if you can relate art by,4
hazel c mon support this lady she is truly wonderful admiration anxiety mental health awareness determination brain,4
1 in 5 college students have anxiety or depression via depression anxiety,4
behavioral health economics comprehensive analysis of global data shows spending money to treat depression and,4
my blog on embrace your neurostyle here s how adhd ocd anxiety mental illness men,4
i want to say i know but if i m honest my stupid mind can t except it and the worse overrules the go,4
here s this week s polly pic she s swaddled in her soft robe anxiety sisters anxiety anxious goat,4
how to manage stress anxiety overwhelm during a high risk pregnancy help yourself stay pregnant,4
contemporary counselors two mental health professionals hired at same time by msum social anxiety anxiety,4
potomac school stages sensory friendly play for autistic community social anxiety anxiety,4
q a until the ribbon breaks pete lawrie winfield on beauty of sobriety after decade of alcohol,4
what it s like to be an english major social anxiety anxiety,4
podcast depression anxiety suffering perspective step 9 steward all of my life for god s glory,4
my blog on embrace your neurostyle here s how adhd ocd anxiety mental illness men,4
gonna start feeling better soon i can t wait i wanna be happy again anxiety depression,4
do not be afraid of the silence meditation anxiety love yourself,4
podcast depression anxiety suffering perspective step 9 steward all of my life for god s glory,4
yoga a form of medicine for stress stress mental health anxiety anxiety problems meditation we l,4
i m fortunate to have neither but i mostly think about those i love like one of my daughters wh,4
yoga a form of medicine for stress stress mental health anxiety anxiety problems meditation we l,4
thoughts mild depression situational depression anxiety these don t seem like the types,4
a charity that uses anime gaming for depression anxiety suicide mental health launched a new,4
people who don t have anxiety and ptsd what the hell do you even think about all day,4
thanks so much for sharing the info and engaging with post really appreciate it stop the stigma anxiety mental health awareness,4
online group session anxiety depression tues 7 30 pm anxiety mental health matters,4
i literally only retweet things because i have to much anxiety to come up with my own things,4
a responsible gun owner despite my mental illness mental health anxiety depression,4
knowledge is power end the stigma mental health awareness friday feeling stop the stigma anxiety,4
knowledge is power end the stigma mental health awareness friday feeling stop the stigma anxiety,4
this mental trick is scientifically proven to reduce anxiety,4
anyone know anxiety quotes inst a,4
how to deal with anxiety caused by perfectionism parenting children anxiety problems,4
this mental trick is scientifically proven to reduce anxiety,4
overcome your fear of driving and restore your freedom and confidence driver anxiety,4
definitely agree with this article but it s not only teenagers but also college students and young adults who hav,4
depression or anxiety no problem toni this is my very first testimony on hempworx do i look depressed i h,4
depression or anxiety no problem toni this is my very first testimony on hempworx do i look depressed i h,4
30 ways to manage speaking anxiety,4
anxiety cells a population of hypothalamus projecting hippocampal neurons encode anxiogenic information and driv,4
yoga a form of medicine for stress stress mental health anxiety anxiety problems meditation we l,4
late late show talking about homelessness over 0 0 0 children without homes ireland 0 1 8 depression anxiety struggling with exams,4
while it remains outside the sphere of federal research a great deal of evidence both formal and anecdotal pinpo,4
yoga a form of medicine for stress stress mental health anxiety anxiety problems meditation we l,4
yoga a form of medicine for stress stress mental health anxiety anxiety problems meditation we l,4
heavy drinking strongest modifiable risk factor for dementia alzheimer s,4
so proud of you bobby on so many levels thanks for destigmatizing anxiety and giving kids and adults hope through your,4
what is anxiety an informative but accessible evidence based read to share the info,4
shavasana baby just in tea form healthy lifestyle study easy fix tea health benefits,4
let s talk about stress don t wait get moving even if only for 10 minutes it will help manage your stress and,4
yoga a form of medicine for stress stress mental health anxiety anxiety problems meditation we l,4
large study of opioid deaths reveals who is at most risk analysis reveals that those with chronic pain,4
what does anxiety feel like to you if you can relate art by,4
the kids are not alright teen anxiety and depression,4
yoga a form of medicine for stress stress mental health anxiety anxiety problems meditation we l,4
yoga a form of medicine for stress stress mental health anxiety anxiety problems meditation we l,4
many of the medications that are usually called antidepresssants have benefit in treatment of anxiety condition,4
what does anxiety feel like to you if you can relate art by,4
i have so much anxiety flowing through my body today i ve actually felt like throwing up all day happy friday anxiety good n,4
what does anxiety feel like to you if you can relate art by,4
a charity that uses anime gaming for depression anxiety suicide mental health launched a new,4
calls out big pharma for opposing legal marijuana via chronic pain medical marijuana,4
you are worth it business women moms anxiety angels readings tarot mentors life coach business coach,4
i was really frazzled today from titration and it was the first time in a bit i had to go out on my own,4
this is what i was talking about before and has a series on anxiety which i highly recommend everyon,4
practically perfect the series brings you practical ideas for supporting people with depression anxiety bipolar an,4
practically perfect the series brings you practical ideas for supporting people with depression anxiety bipolar an,4
the praiseworthy mindset ties back into a heart that is ruled and guarded by the prince and lord of peace,4
the real causes of depression have been discovered and they re not what you think depression depressed anxiety,4
what does anxiety feel like to you if you can relate art by,4
biblical truth prayerlessness yields anxiety yields depression,4
my blog on embrace your neurostyle here s how adhd ocd anxiety mental illness men,4
coaching thanks to for these top tips on dealing with anxiety,4
practically perfect the series brings you practical ideas for supporting people with depression anxiety bipolar an,4
bad news stress is here to stay good news here s what to do about it life coach anxiety,4
how yoga eases depression and stress stress depression anxiety biofeedback mindfulness menta,4
how yoga eases depression and stress stress depression anxiety biofeedback,4
your mind and body don t hate you it s a sensitive system that we all have within us and we have the capability t,4
5 reasons exercise is good for anxiety anxiety mental health depression pn d exercise,4
anxious kids at school how to help them soar sigmund anxiety educ hat parenting tips,4
frequent and prolonged spikes in cortisol are extremely detrimental to overall health possibly leading to depressi,4
practically perfect the series brings you practical ideas for supporting people with depression anxiety,4
someone stop the world and i ll get the fuck off now cheers fucking hell depression anxiety ptsd self harm,4
do not be afraid of the silence meditation anxiety love yourself,4
anxiety cells a population of hypothalamus projecting hippocampal neurons encode anxiogenic information and driv,4
friday feeling we are still in the early stages of learning what plant based cbd oil from hemp can or cannot do bu,4
yoga a form of medicine for stress stress mental health anxiety anxiety problems meditation we l,4
anxiety cells a population of hypothalamus projecting hippocampal neurons encode anxiogenic information and driv,4
forum can phobias lead to addiction and substance abuse phobias anxiety phobia treatments phobia fo,4
yoga a form of medicine for stress stress mental health anxiety anxiety problems meditation we l,4
anxiety cells a population of hypothalamus projecting hippocampal neurons encode anxiogenic information and driv,4
do not be afraid of the silence meditation anxiety love yourself,4
i know i need to exercise to have more energy but i m so exhausted and idk if i have the energy to exercise such,4
what does anxiety feel like to you if you can relate art by,4
what does anxiety feel like to you if you can relate art by,4
we have recently met a lady who won t leave the house due to her stoma embarrassing noises and the thought that,4
this is what i was talking about before and has a series on anxiety which i highly recommend eve,4
an open letter to my depression beech at teacup club,4
my baby my comfort hiding behind your little one in social situations social anxiety anxiety,4
how a student created a vest that could help people coping with stress and anxiety stress anxiety,4
went to ikea this afternoon for some reason came back with mental ill claustra phobia anxiety paranoia aching legs,4
what does anxiety feel like to you if you can relate art by,4
there are two sides to every coin anxiety recovery,4
forum an amazing care coordinator phobias anxiety phobia treatments phobia forum,4
nearly finished my blogpost on the first of a series in anxiety post 1 what is anxiety lots of research gon,4
etizolam is used as medicine to treat anxiety insomnia and panic attacks,4
i have so much anxiety flowing through my body today i ve actually felt like throwing up all day happy friday,4
does a child s anxiety increase when they do not like their teacher nlp 4 k i d s nunn s nlp building confidence cambridgeshire,4
what is test anxiety and how can you overcome it education testing anxiety,4
tom bought me a balloon to cheer me up balloons depression sucks anxiety happy feeling loved,4
food allergy anxiety how to cope food allergies anxiety living in fear,4
what does anxiety feel like to you if you can relate art by,4
going to my daughters job unannounced ine eda pill anxiety woo os aaa,4
felt pretty close to normal me today that s 2 days in row took a panic attack tonight but was able to get it und,4
how to manage school anxiety in wake of violence threats via anxiety,4
a charity that uses anime gaming for depression anxiety suicide mental health launched a new,4
the power of the mind depression stress anxiety are not proven to be congenital physical disorders that require,4
yoga a form of medicine for stress stress mental health anxiety anxiety problems,4
my blog on embrace your neurostyle here s how adhd ocd anxiety mental illness men,4
your brain is telling you to move but your body doesn t know how to get up and just be just live anxiety and,4
what does anxiety feel like to you if you can relate art by,4
one of my students said that she was quiet because she didn t feel she knew anything had given her back a b grade,4
fighting loneliness can be painstaking process but you owe it to yourself to heal here is how you can tackle lone,4
chicago made app aims to reduce anxiety depression caused by social media e health health apps h,4
from anxiety to love with anxiety panic stress healing inner peace podcast,4
no amount of anxiety makes any difference to anything that is going to happen,4
and i proactively asked for someone to sit with me while i had a panic attack and i comprehensively told people my,4
today i did a lot of talking and telling people i m not ok not quite how not ok i am but it s a start,4
thank you 4 testing my patience and attempt to increase my anxiety levels no way u could succeed i came,4
all you need to know about agitated depression depression anxietytensionmedical researchbehavioral science,4
don t let anxiety keep you from your healing journey read on gt gt anxiety mental health,4
psychological stress and anxiety as important as physical stress in immune response to exercise,4
do you suffer from anxiety depression and panic you are not alone and there is help out there for you to improve tha,4
life s pressures can soon add up and make you feel like you cannot escape them but talking can help we have a hig,4
what does anxiety feel like to you if you can relate art by,4
homeopathic remedies for anxiety are often more effective than most drugs or prescriptionmeds,4
what does anxiety feel like to you if you can relate art by,4
learn strategies to reduce anxiety in your home encourage healthy habits and get your kids on track for success,4
chicago made app aims to reduce anxiety depression caused by social media e health,4
what does anxiety feel like to you if you can relate art by,4
thanks for the retweet did you listen to this episode of the dear rita podcast where i talk to brith,4
i know let s push him away and give him more reason to probably leave me fantastic depression anxiety ptsd fuck sake,4
according to a new study more americans suffer from depression anxiety and often too poor to afford treatment,4
i hate toxic relationships but every time i try to leave anxiety the bitch some how finds me depression anxiety toxic relationships,4
coaching thanks to for these top tips on dealing with anxiety,4
c mon support this lady she is truly wonderful admiration anxiety mental health awareness determination,4
find peace in knowing ain t always broken my music video for post malo via,4
puppy therapy be happy and well everyone live in the moment be amazing friday feeling depression anxiety suicide,4
does cbd reduce anxiousness anxiety does cbd reduce anxiousness brought on by consuming high amounts of,4
so happy i managed to make it out to see the lights tonight also really enjoyed walking round sneinton market look,4
release emotions triggering back pain skin conditions weight loss fitness blocks public speaking anxiety intuition,4
with our anxiety depression after cancer workshop coming soon check out this shine podcast discussing these issues,4
15 anxiety tips to help you live better anxiety problems anxiety anxious distractions look at,4
are you suffering from pn d anxiety or depression come and read my interview with camilla creator of the mood,4
what does anxiety feel like to you if you can relate art by,4
5 tips for improving your bond with you baby when you re suffering from postnatal depression,4
psychological stress and anxiety as important as physical stress in immune response to exercise,4
what does anxiety feel like to you if you can relate art by,4
what does anxiety feel like to you if you can relate art by,4
cbd hemp oil products 100 u s grown processed hemp products health anti aging nutrition pets m,4
what does anxiety feel like to you if you can relate art by,4
6 ways to ease anxiety symptoms without medication mental health,4
higher the year of conquering negative thinking mental health anxiety mindfulness,4
help for a miracle needed the greatest gift of all please help my dreams of having a baby come true by sharing my,4
what does anxiety feel like to you if you can relate art by,4
what does anxiety feel like to you if you can relate art by,4
what does anxiety feel like to you if you can relate art by,4
how to declutter your home to reduce anxiety and stress anxiety,4
do not be afraid of the silence meditation anxiety love yourself,4
what does anxiety feel like to you if you can relate art by,4
focus on valuing others and feel your self esteem grow parenting worry anxiety the mood cards via,4
what does anxiety feel like to you if you can relate art by,4
puppy therapy be happy and well everyone live in the moment be amazing friday feeling depression anxiety suicide,4
hypnotherapy is good for anger anxiety confidence building fears insomnia negativity pain management phobias,4
what does anxiety feel like to you if you can relate art by,4
what does anxiety feel like to you if you can relate art by,4
anxiety can paralyze you when it sets in releasing or changing the situation just slightly can create a big impact,4
could your anxiety be a sign of adhd anxiety adhd,4
what does anxiety feel like to you if you can relate art by,4
puppy therapy be happy and well everyone live in the moment be amazing friday feeling depression anxiety,4
my blog on embrace your neurostyle here s how adhd ocd anxiety mental illness men,4
what does anxiety feel like to you if you can relate art by,4
7 days wotw really bad day took dog in streaming to distract feelings,4
what does anxiety feel like to you if you can relate art by,4
what does anxiety feel like to you if you can relate art by,4
if you re one of the 40 million adults who suffer from anxiety this interview with abo,4
anxiety and your health what you need to ask your doctor podcast life,4
my blog on embrace your neurostyle here s how adhd ocd anxiety mental illness men,4
nine to 40 of employees continue to be exposed to bullying in their workplace often with mental health impacts,4
my blog on embrace your neurostyle here s how adhd ocd anxiety mental illness men,4
if you suffer from chronic pain anxiety or want to live a healthier life than cbd is for you its life changing pe,4
what does anxiety feel like to you if you can relate art by,4
my blog on embrace your neurostyle here s how adhd ocd anxiety mental illness men,4
are you feeling anxiety about returning to work access to work is here for you for details ht,4
my blog on embrace your neurostyle here s how adhd ocd anxiety mental illness men,4
this really helps addiction recovery anxiety,4
mental health resources early mornings with herman thomas ptsd anxiety grief depression drug abuse 14,4
my blog on embrace your neurostyle here s how adhd ocd anxiety mental illness men,4
my blog on embrace your neurostyle here s how adhd ocd anxiety mental illness men,4
my blog on embrace your neurostyle here s how adhd ocd anxiety mental illness men,4
what does anxiety feel like to you if you can relate art by,4
united tomorrow guys 10am mental health support football therapy awareness sport therapy depression anxiety strength,4
my blog on embrace your neurostyle here s how adhd ocd anxiety,4
the anxiety of speaking in front of groups the fear of being judged negatively by others the feeling of being a,4
really looking forward to being part of your fantastic earl years roots of resilience conference tomorrow,4
calm the mind and body with yoga meditation reduce your stress anxiety and pain right now,4
have you seen the latest results of our ontrak program we re reducing costs by an average of 54 for health plans,4
meet the therapist tara dubrow llb rp ba atppp member capt specializing in anxiety depression,4
if i pass out fall over here at work would they finally take my chronic illness seriously fibro myalgia,4
4 pm reminder you are ok you are safe don t panic anxiety calm panic,4
asmr 4 hour ear brushing sleep assistance anxiety aid a smr binaural sound sleep anxiety wellness aid,4
i was talking about ways to help anxiety attacks on periscope and i promised to post the video that helps me lis,4
psychology untreated children with anxiety disorders are at higher risk to perform poorly in school miss out on social expe,4
how can you make better decisions anxiety cognition intelligence intuition memory,4
when your fight or flight response anxiety brain fog,4
munt 3 things to say when your friend is having a panic attack the hippochronicles via anxiety panic me,4
enjoy instant benefits of deep relaxation anxiety self help,4
rainbow heart essential oil diffuser necklace pendant anxiety aromatherapy handmade valentines day diffuser,4
calm the mind and body with yoga meditation reduce your stress anxiety and pain right now,4
an amazing care coordinator phobias anxiety phobia treatments phobia forum,4
pause app 1 pause app android app free app to monitor usage of social media mental health anxiety d,4
trk a r manhattan ny grime y inked gram kill a pursuit of portraits b nw life faded anxiety,4
don t stress over what you can t control stress control anxiety success mark robbins network,4
the anxiety of speaking in front of groups the fear of being judged negatively by others the feeling of bein,4
anxiety nobilis therapeutics presents its ptsd clinical development program to the us congress washington feb 2,4
hypnotherapy is good for anger anxiety confidence building fears insomnia negativity pain management,4
3 things to say when your friend is having a panic attack the hippochronicles via anxiety,4
1 in 5 will experience mental health issues this year but there is a lot of stigma on mental illness movies have,4
knowledge is power and prevention read my post on childhood anxiety anxiety c bt mental heal t,4
i m at the airport 2 hours early cause anxiety bois,4
writing romance am writing anxiety family issues relationships romance writing,4
depression anxiety stress quit smoking want to talk to see how i can help 07967807654 or email kftait com brom le,4
does meditation really help with depression and anxiety read more at meditation depression anxiety,4
anxiety and depression often shadow arab youth psychology mental illness mental health,4
first call is a pt suffering anxiety taken to exercise yard for some fresh air meds administered and reassurance given,4
yep felt a fair few of what s on here anxiety problems anxiety mental health people like keep inspiring,4
anxiety cells a population of hypothalamus projecting hippocampal neurons encode anxiogenic information and driv,4
um instagram suppressed my post with hashtags related to mental health my post is about how animals can improve,4
go to pharmacy get kiddo 2 s meds fixed damn insurance company my anxiety was really high anxiety,4
subscribe here ptsd ptsd chat mental health mental illness trauma depression anxiety,4
a night of relaxation detox and anxiety relief soak for 1 hour in a detox tea bath today for only 8 00 click the,4
excited to sing some mantras and even try to write our own anxiety swat ca,4
